{
  "id": "e2e-16",
  "fixture": "two-component-feature",
  "owner_message": "Implementa la feature completa de saludo mediante el pipeline. El flujo debe conservar una sola sesión Supervisor por este flow para descomposición, review e integración; cada Implementer debe ser nuevo y trabajar en su propio worktree. Después de enlazar la primera sesión Supervisor, ejecuta en el board aislado los controles nativos de aislamiento entre flow, Project y rol, el rechazo de una generación obsoleta y las rutas de notificación terminal, input y revisión, manteniendo los hitos internos sin despertar al origen. Usa únicamente las acciones nativas de Kanban y deja que el arnés observe de forma independiente las bases SQLite, los procesos y las sesiones; no fabriques recibos en task metadata ni incluyas prompts, respuestas, comandos, logs o rutas. Verifica la aceptación y devuelve el resultado terminal sin pedir otra intervención del propietario.",
  "expected_route": "pipeline",
  "acceptance_command": ["python3", "verify.py"],
  "timeout_seconds": 1800,
  "max_dispatch_passes": 120,
  "scripted_replies": [],
  "forbidden_paths": [],
  "required_paths": [".aether/objective-contracts"],
  "live_requires_spend": true
}
